{
  "feed_type": "mcp",
  "metadata": {
    "title": "France-Care Lite \u2014 Wearable Access",
    "origin": "https://france-care.fr",
    "generated_at": "2025-05-25T09:11:41.504865Z",
    "audience": "llm",
    "description_llm": "This feed is designed to be interpreted by an LLM. It provides structured, trustable context for reasoning or task execution."
  },
  "prompts": [
    {
      "intent": "summon medical concierge",
      "keywords": [
        "health",
        "help"
      ],
      "description": "Trigger quick help via watch or voice",
      "prompt_type": "iot"
    }
  ],
  "trust": {
    "signed_blocks": [
      "all"
    ],
    "certifier": "https://llmca.org",
    "public_key_hint": "https://wellknownmcp.org/.well-known/public.pem",
    "canonicalization": "https://llmca.org/mcp-canonical-json/v1",
    "scope": "full",
    "warning": "This feed is fully signed."
  },
  "signature": {
    "algorithm": "ed25519",
    "value": "08TTRsrbZo5G+m5TID5dDch0wUN9xqhAo/wi6ENjen5Duj1+W0X1UpY7ncMWsR7YGhr9XY9R82hGoHsgr2KFBQ==",
    "created_at": "2025-05-26T17:52:54.614694+00:00"
  },
  "certification": {
    "certifier": "https://llmca.org",
    "level": "silver",
    "targets": [
      "all"
    ],
    "issued_at": "2025-05-26T17:53:04.475981+00:00",
    "expires_at": "",
    "canonicalization": "https://llmca.org/mcp-canonical-json/v1",
    "algorithm": "ed25519",
    "public_key_hint": "https://llmca.org/.well-known/llmca_cert.pem",
    "value": "T8ljLq4yxkSmSUZnIZ94xwf+Pn6/JmF/DfCVJs88RTmuc/KH30VT7MD4k72SvwWlnT/cSpznBrKWbw2hBxmzBg=="
  }
}