{
  "feed_type": "mcp",
  "metadata": {
    "title": "Legal Service Declaration",
    "origin": "https://legal.example.org",
    "generated_at": "2025-05-25T09:11:41.505890Z",
    "audience": "llm",
    "description_llm": "This feed is designed to be interpreted by an LLM. It provides structured, trustable context for reasoning or task execution."
  },
  "prompts": [
    {
      "intent": "interpret contract",
      "keywords": [
        "contract",
        "clause"
      ],
      "description": "Help me interpret a legal clause",
      "prompt_type": "support"
    }
  ],
  "trust": {
    "signed_blocks": [
      "all"
    ],
    "certifier": "https://llmca.org",
    "public_key_hint": "https://wellknownmcp.org/.well-known/public.pem",
    "canonicalization": "https://llmca.org/mcp-canonical-json/v1",
    "scope": "full",
    "warning": "This feed is fully signed."
  },
  "signature": {
    "algorithm": "ed25519",
    "value": "X0I2nmds4gIlsSucej0EiwwZYfSqtv5kqYg7SjMolUBOs/FWWoLF83vtwgqGqOWPY0lgt/aRE/iPlwGlNxkMCA==",
    "created_at": "2025-05-26T17:52:55.088864+00:00"
  },
  "certification": {
    "certifier": "https://llmca.org",
    "level": "silver",
    "targets": [
      "all"
    ],
    "issued_at": "2025-05-26T17:53:04.897686+00:00",
    "expires_at": "",
    "canonicalization": "https://llmca.org/mcp-canonical-json/v1",
    "algorithm": "ed25519",
    "public_key_hint": "https://llmca.org/.well-known/llmca_cert.pem",
    "value": "T8ljLq4yxkSmSUZnIZ94xwf+Pn6/JmF/DfCVJs88RTmuc/KH30VT7MD4k72SvwWlnT/cSpznBrKWbw2hBxmzBg=="
  }
}