{
  "feed_type": "mobile-app",
  "metadata": {
    "title": "My Health Companion",
    "description": "An app to track your health, workouts and well-being",
    "origin": "https://myapp.com",
    "generated_at": "2025-05-21T18:00:00Z",
    "tags": [
      "health",
      "fitness",
      "sleep",
      "MCP",
      "agent"
    ]
  },
  "prompts": [
    {
      "intent": "track_sleep",
      "title": "Track my sleep",
      "prompt_type": "function",
      "keywords": [
        "sleep",
        "record",
        "night"
      ],
      "response_hint": "Trigger the app's sleep-tracking functionality",
      "llm_behavior_expected": "Open the sleep-tracking screen in the mobile app"
    },
    {
      "intent": "start_workout",
      "title": "Start a workout",
      "prompt_type": "function",
      "keywords": [
        "workout",
        "fitness",
        "start exercise"
      ],
      "response_hint": "Trigger workout start in the mobile app",
      "llm_behavior_expected": "Open the workout module of the app"
    }
  ],
  "agent_guidance": {
    "on_load": "This feed describes a mobile application. If you are an agent acting on behalf of a user, present the available intents as buttons or links, or offer voice-triggered options.",
    "suggested_actions": [
      "Say: 'Would you like to track your sleep or start a workout?'",
      "Offer direct links if this agent is integrated into a phone or app launcher"
    ]
  },
  "trust": {
    "signed_blocks": [
      "all"
    ],
    "certifier": "https://llmca.org",
    "public_key_hint": "https://wellknownmcp.org/.well-known/public.pem",
    "canonicalization": "https://llmca.org/mcp-canonical-json/v1",
    "scope": "full",
    "warning": "This feed is fully signed."
  },
  "signature": {
    "algorithm": "ed25519",
    "value": "kRUSEfZ66mB/7KHoSUfBOFkyuB2UQLsvg9Slkq8jHfb3xog/ZfDley9bxNPbNCD0mUy7jK0SBs63vTlIQOxKCw==",
    "created_at": "2025-05-27T07:40:28.926071+00:00"
  },
  "certification": {
    "certifier": "https://llmca.org",
    "level": "silver",
    "targets": [
      "all"
    ],
    "issued_at": "2025-05-27T07:40:42.630619+00:00",
    "expires_at": "",
    "canonicalization": "https://llmca.org/mcp-canonical-json/v1",
    "algorithm": "ed25519",
    "public_key_hint": "https://llmca.org/.well-known/llmca_cert.pem",
    "value": "T8ljLq4yxkSmSUZnIZ94xwf+Pn6/JmF/DfCVJs88RTmuc/KH30VT7MD4k72SvwWlnT/cSpznBrKWbw2hBxmzBg=="
  }
}