{
  "feed_type": "export",
  "metadata": {
    "title": "LLM Session Export",
    "origin": "https://publisher.example.com",
    "generated_at": "2025-05-25T09:11:41.512988Z",
    "audience": "llm",
    "description_llm": "This feed is designed to be interpreted by an LLM. It provides structured, trustable context for reasoning or task execution."
  },
  "data": [
    {
      "type": "session",
      "summary": "Discussion on the latest editorial",
      "content": "..."
    }
  ],
  "trust": {
    "signed_blocks": [
      "all"
    ],
    "certifier": "https://llmca.org",
    "public_key_hint": "https://wellknownmcp.org/.well-known/public.pem",
    "canonicalization": "https://llmca.org/mcp-canonical-json/v1",
    "scope": "full",
    "warning": "This feed is fully signed."
  },
  "signature": {
    "algorithm": "ed25519",
    "value": "j4N/C+N0kiwpHEjScdN5E3AA5tlEMWb6cMngUmNTBGKuc4WXI072J7xEb5UFAa+BCjejd5i1myOh7L6cRJfbAw==",
    "created_at": "2025-05-26T17:52:56.325917+00:00"
  },
  "certification": {
    "certifier": "https://llmca.org",
    "level": "silver",
    "targets": [
      "all"
    ],
    "issued_at": "2025-05-26T17:53:06.449720+00:00",
    "expires_at": "",
    "canonicalization": "https://llmca.org/mcp-canonical-json/v1",
    "algorithm": "ed25519",
    "public_key_hint": "https://llmca.org/.well-known/llmca_cert.pem",
    "value": "T8ljLq4yxkSmSUZnIZ94xwf+Pn6/JmF/DfCVJs88RTmuc/KH30VT7MD4k72SvwWlnT/cSpznBrKWbw2hBxmzBg=="
  }
}